{
  "version": 1,
  "minimumGate": { "passed": true, "missing": [] },
  "brand": { "name": "Acme Shop", "palette": "violet", "wordmark": "f.app.name.1" },
  "facts": [
    { "id": "f.app.name.1", "kind": "app.name", "value": "Acme Shop", "display": "Acme Shop", "unit": null, "source": { "file": "package.json", "locator": "name", "extractor": "fixture", "rule": "fixture" }, "hash": "sha256:0000000000000001" },
    { "id": "f.command.1", "kind": "command", "value": "npm run dev", "display": "npm run dev", "unit": null, "source": { "file": "package.json", "locator": "scripts.dev", "extractor": "fixture", "rule": "fixture" }, "hash": "sha256:0000000000000002" },
    { "id": "f.feature.1", "kind": "feature", "value": "Checkout in one tap", "display": "Checkout in one tap", "unit": null, "source": { "file": "README.md", "locator": "features", "extractor": "fixture", "rule": "fixture" }, "hash": "sha256:0000000000000003" },
    { "id": "f.stack.item.1", "kind": "stack.item", "value": "Next.js 16 + React 19 UI", "display": "Next.js 16 + React 19 UI", "unit": null, "source": { "file": "package.json", "locator": "dependencies", "extractor": "fixture", "rule": "fixture" }, "hash": "sha256:0000000000000004" },
    { "id": "f.stack.item.2", "kind": "stack.item", "value": "MCP SERVERS WIRED IN NOW", "display": "MCP SERVERS WIRED IN NOW", "unit": null, "source": { "file": "package.json", "locator": "dependencies", "extractor": "fixture", "rule": "fixture" }, "hash": "sha256:0000000000000005" },
    { "id": "f.stack.item.3", "kind": "stack.item", "value": "TanStack Query Data Sync", "display": "TanStack Query Data Sync", "unit": null, "source": { "file": "package.json", "locator": "dependencies", "extractor": "fixture", "rule": "fixture" }, "hash": "sha256:0000000000000006" },
    { "id": "f.stack.item.4", "kind": "stack.item", "value": "Iron Session Cookie Auth", "display": "Iron Session Cookie Auth", "unit": null, "source": { "file": "package.json", "locator": "dependencies", "extractor": "fixture", "rule": "fixture" }, "hash": "sha256:0000000000000007" },
    { "id": "f.stack.item.5", "kind": "stack.item", "value": "PLAYWRIGHT E2E WORKFLOWS", "display": "PLAYWRIGHT E2E WORKFLOWS", "unit": null, "source": { "file": "package.json", "locator": "dependencies", "extractor": "fixture", "rule": "fixture" }, "hash": "sha256:0000000000000008" }
  ]
}
