{
  "version": 1,
  "minimumGate": { "passed": true, "missing": [] },
  "brand": { "name": "Acme Shop", "palette": "violet", "wordmark": "f.app.name.1" },
  "facts": [
    { "id": "f.app.name.1", "kind": "app.name", "value": "Acme Shop", "display": "Acme Shop", "unit": null, "source": { "file": "synthetic", "locator": "app.name/1", "extractor": "test", "rule": "synthetic" }, "hash": "sha256:0000000000000000" },
    { "id": "f.command.1", "kind": "command", "value": "npm run dev", "display": "npm run dev", "unit": null, "source": { "file": "synthetic", "locator": "command/1", "extractor": "test", "rule": "synthetic" }, "hash": "sha256:0000000000000000" },
    { "id": "f.command.2", "kind": "command", "value": "npm run db:migrate -- --seed", "display": "npm run db:migrate -- --seed", "unit": null, "source": { "file": "synthetic", "locator": "command/2", "extractor": "test", "rule": "synthetic" }, "hash": "sha256:0000000000000000" },
    { "id": "f.route.1", "kind": "route", "value": "/api/orders/[orderId]/refund", "display": "/api/orders/[orderId]/refund", "unit": null, "source": { "file": "synthetic", "locator": "route/1", "extractor": "test", "rule": "synthetic" }, "hash": "sha256:0000000000000000" },
    { "id": "f.route.2", "kind": "route", "value": "/account/settings/billing/me", "display": "/account/settings/billing/me", "unit": null, "source": { "file": "synthetic", "locator": "route/2", "extractor": "test", "rule": "synthetic" }, "hash": "sha256:0000000000000000" },
    { "id": "f.feature.1", "kind": "feature", "value": "Guest checkout in one click", "display": "Guest checkout in one click", "unit": null, "source": { "file": "synthetic", "locator": "feature/1", "extractor": "test", "rule": "synthetic" }, "hash": "sha256:0000000000000000" },
    { "id": "f.feature.2", "kind": "feature", "value": "Webhooks With Workflow Rules", "display": "Webhooks With Workflow Rules", "unit": null, "source": { "file": "synthetic", "locator": "feature/2", "extractor": "test", "rule": "synthetic" }, "hash": "sha256:0000000000000000" },
    { "id": "f.feature.3", "kind": "feature", "value": "Live inventory per warehouse", "display": "Live inventory per warehouse", "unit": null, "source": { "file": "synthetic", "locator": "feature/3", "extractor": "test", "rule": "synthetic" }, "hash": "sha256:0000000000000000" },
    { "id": "f.feature.4", "kind": "feature", "value": "Order history with receipts", "display": "Order history with receipts", "unit": null, "source": { "file": "synthetic", "locator": "feature/4", "extractor": "test", "rule": "synthetic" }, "hash": "sha256:0000000000000000" },
    { "id": "f.stack.item.1", "kind": "stack.item", "value": "Tailwind CSS Typography v4", "display": "Tailwind CSS Typography v4", "unit": null, "source": { "file": "synthetic", "locator": "stack.item/1", "extractor": "test", "rule": "synthetic" }, "hash": "sha256:0000000000000000" },
    { "id": "f.stack.item.2", "kind": "stack.item", "value": "Next.js", "display": "Next.js", "unit": null, "source": { "file": "synthetic", "locator": "stack.item/2", "extractor": "test", "rule": "synthetic" }, "hash": "sha256:0000000000000000" },
    { "id": "f.stack.item.3", "kind": "stack.item", "value": "Prisma", "display": "Prisma", "unit": null, "source": { "file": "synthetic", "locator": "stack.item/3", "extractor": "test", "rule": "synthetic" }, "hash": "sha256:0000000000000000" },
    { "id": "f.stack.item.4", "kind": "stack.item", "value": "Tailwind", "display": "Tailwind", "unit": null, "source": { "file": "synthetic", "locator": "stack.item/4", "extractor": "test", "rule": "synthetic" }, "hash": "sha256:0000000000000000" },
    { "id": "f.feature.5", "kind": "feature", "value": "Order tracking", "display": "Order tracking", "unit": null, "source": { "file": "synthetic", "locator": "feature/5", "extractor": "test", "rule": "synthetic" }, "hash": "sha256:0000000000000000" },
    { "id": "f.feature.6", "kind": "feature", "value": "Saved carts", "display": "Saved carts", "unit": null, "source": { "file": "synthetic", "locator": "feature/6", "extractor": "test", "rule": "synthetic" }, "hash": "sha256:0000000000000000" },
    { "id": "f.route.3", "kind": "route", "value": "/cart", "display": "/cart", "unit": null, "source": { "file": "synthetic", "locator": "route/3", "extractor": "test", "rule": "synthetic" }, "hash": "sha256:0000000000000000" },
    { "id": "f.command.3", "kind": "command", "value": "npm test", "display": "npm test", "unit": null, "source": { "file": "synthetic", "locator": "command/3", "extractor": "test", "rule": "synthetic" }, "hash": "sha256:0000000000000000" },
    { "id": "f.feature.11", "kind": "feature", "value": "Clone the repo and cd in it", "display": "Clone the repo and cd in it", "unit": null, "source": { "file": "synthetic", "locator": "readme.steps.1/1", "extractor": "test", "rule": "synthetic" }, "collection": "readme.steps.1", "order": 1, "sequence": 1, "hash": "sha256:0000000000000000" },
    { "id": "f.command.11", "kind": "command", "value": "npm ci --ignore-scripts=true", "display": "npm ci --ignore-scripts=true", "unit": null, "source": { "file": "synthetic", "locator": "readme.steps.1/2", "extractor": "test", "rule": "synthetic" }, "collection": "readme.steps.1", "order": 2, "sequence": 2, "hash": "sha256:0000000000000000" },
    { "id": "f.feature.12", "kind": "feature", "value": "Add your keys to .env.local", "display": "Add your keys to .env.local", "unit": null, "source": { "file": "synthetic", "locator": "readme.steps.1/3", "extractor": "test", "rule": "synthetic" }, "collection": "readme.steps.1", "order": 3, "sequence": 3, "hash": "sha256:0000000000000000" },
    { "id": "f.command.12", "kind": "command", "value": "npm run db:migrate -- --seed", "display": "npm run db:migrate -- --seed", "unit": null, "source": { "file": "synthetic", "locator": "readme.steps.1/4", "extractor": "test", "rule": "synthetic" }, "collection": "readme.steps.1", "order": 4, "sequence": 4, "hash": "sha256:0000000000000000" },
    { "id": "f.feature.13", "kind": "feature", "value": "Open localhost:3000 to start", "display": "Open localhost:3000 to start", "unit": null, "source": { "file": "synthetic", "locator": "readme.steps.1/5", "extractor": "test", "rule": "synthetic" }, "collection": "readme.steps.1", "order": 5, "sequence": 5, "hash": "sha256:0000000000000000" },
    { "id": "f.command.13", "kind": "command", "value": "npm run build && npm start", "display": "npm run build && npm start", "unit": null, "source": { "file": "synthetic", "locator": "readme.steps.1/6", "extractor": "test", "rule": "synthetic" }, "collection": "readme.steps.1", "order": 6, "sequence": 6, "hash": "sha256:0000000000000000" },
    { "id": "f.command.14", "kind": "command", "value": "npm install", "display": "npm install", "unit": null, "source": { "file": "synthetic", "locator": "readme.steps.2/1", "extractor": "test", "rule": "synthetic" }, "collection": "readme.steps.2", "order": 1, "sequence": 1, "hash": "sha256:0000000000000000" },
    { "id": "f.feature.14", "kind": "feature", "value": "Add .env", "display": "Add .env", "unit": null, "source": { "file": "synthetic", "locator": "readme.steps.2/2", "extractor": "test", "rule": "synthetic" }, "collection": "readme.steps.2", "order": 2, "sequence": 2, "hash": "sha256:0000000000000000" },
    { "id": "f.command.15", "kind": "command", "value": "npm run seed", "display": "npm run seed", "unit": null, "source": { "file": "synthetic", "locator": "readme.steps.2/3", "extractor": "test", "rule": "synthetic" }, "collection": "readme.steps.2", "order": 3, "sequence": 3, "hash": "sha256:0000000000000000" },
    { "id": "f.command.16", "kind": "command", "value": "npm run dev", "display": "npm run dev", "unit": null, "source": { "file": "synthetic", "locator": "readme.steps.2/4", "extractor": "test", "rule": "synthetic" }, "collection": "readme.steps.2", "order": 4, "sequence": 4, "hash": "sha256:0000000000000000" },
    { "id": "f.feature.15", "kind": "feature", "value": "Sign in", "display": "Sign in", "unit": null, "source": { "file": "synthetic", "locator": "readme.steps.2/5", "extractor": "test", "rule": "synthetic" }, "collection": "readme.steps.2", "order": 5, "sequence": 5, "hash": "sha256:0000000000000000" },
    { "id": "f.command.17", "kind": "command", "value": "npm test", "display": "npm test", "unit": null, "source": { "file": "synthetic", "locator": "readme.steps.2/6", "extractor": "test", "rule": "synthetic" }, "collection": "readme.steps.2", "order": 6, "sequence": 6, "hash": "sha256:0000000000000000" }
  ]
}
